{
  "$schema": "https://json-schema.org/draft/2020-12/schema",
  "$id": "https://auto-pilot/swarm/schemas/verify.schema.json",
  "title": "VerifierSubBlock",
  "description": "Shape of the 'verifier' sub-object that the swarm-verifier agent injects into an existing score file (.planning/autopilot/scores/<TID>.json). Validates the VALUE of the 'verifier' key, not the outer score wrapper.",
  "type": "object",
  "required": ["passed", "evidence", "reproductions", "downgraded_to", "notes"],
  "additionalProperties": false,
  "properties": {
    "passed": {
      "type": "boolean"
    },
    "evidence": {
      "type": "object",
      "required": ["cmd_output", "files_checked", "diff_sha"],
      "additionalProperties": false,
      "properties": {
        "cmd_output": {
          "type": "string"
        },
        "files_checked": {
          "type": "array",
          "items": { "type": "string" },
          "minItems": 0
        },
        "diff_sha": {
          "type": "string",
          "pattern": "^[a-f0-9]{7,40}$"
        }
      }
    },
    "reproductions": {
      "type": "array",
      "items": {
        "type": "object",
        "required": ["scenario", "cmd", "observed"],
        "additionalProperties": false,
        "properties": {
          "scenario": { "type": "string" },
          "cmd": { "type": "string" },
          "observed": { "type": "string" }
        }
      }
    },
    "downgraded_to": {
      "type": ["null", "string"],
      "enum": [null, "request-changes", "reject"]
    },
    "notes": {
      "type": "string"
    }
  }
}
